{
  "id": "11.1/log/url-result/baseline",
  "request": {
    "type": "log",
    "log_type": "url",
    "log_phase": "result"
  },
  "panos_version": "11.1",
  "description": "3 url log entries, newest first",
  "provenance": {
    "source": "synthetic",
    "url": "https://docs.paloaltonetworks.com/pan-os/9-1/pan-os-panorama-api/pan-os-xml-api-request-types/retrieve-logs-api",
    "notes": "Hand-authored response following the request/response structure described in the PAN-OS and Panorama XML API guide (provenance.url); not a verbatim copy. Unverified against a live Panorama."
  },
  "sanitization": {
    "tool_version": "panos-mcp 0.1.0",
    "sanitized_at": "2026-10-17T08:26:22Z",
    "leak_check": "passed"
  },
  "status": "unverified"
}
