{
  "id": "11.2/op/show-object-dynamic-address-group-name/baseline",
  "request": {
    "type": "op",
    "cmd": "<show><object><dynamic-address-group><name>dyn-web</name></dynamic-address-group></object></show>",
    "target": "900000000001"
  },
  "panos_version": "11.2",
  "description": "Members of dynamic address group dyn-web on fw-hq-01",
  "provenance": {
    "source": "synthetic",
    "url": "https://docs.paloaltonetworks.com/pan-os/11-1/pan-os-panorama-api/pan-os-xml-api-use-cases/query-a-firewall-from-panorama-api",
    "notes": "Hand-authored response following the request/response structure described in the PAN-OS and Panorama XML API guide (provenance.url); not a verbatim copy. Unverified against a live Panorama. Identical in structure to the 11.1 sample per documentation (11.1 & later guide)."
  },
  "sanitization": {
    "tool_version": "panos-mcp 0.1.0",
    "sanitized_at": "2026-10-17T07:54:27Z",
    "leak_check": "passed"
  },
  "status": "unverified"
}
