{
  "id": "11.1/op/test-security-policy-match/no-match",
  "request": {
    "type": "op",
    "cmd": "<test><security-policy-match><from>dmz</from><to>trust</to><source>10.20.1.10</source><destination>10.10.1.5</destination><protocol>17</protocol><destination-port>161</destination-port></security-policy-match></test>",
    "target": "900000000001"
  },
  "panos_version": "11.1",
  "description": "No rule matches; default rule applies",
  "provenance": {
    "source": "synthetic",
    "url": "https://docs.paloaltonetworks.com/pan-os/11-1/pan-os-panorama-api/pan-os-xml-api-use-cases/query-a-firewall-from-panorama-api",
    "notes": "Hand-authored response following the request/response structure described in the PAN-OS and Panorama XML API guide (provenance.url); not a verbatim copy. Unverified against a live Panorama."
  },
  "sanitization": {
    "tool_version": "panos-mcp 0.1.0",
    "sanitized_at": "2026-10-17T08:26:22Z",
    "leak_check": "passed"
  },
  "status": "unverified"
}
