{
  "id": "11.1/op/show-jobs-id/not-found",
  "request": {
    "type": "op",
    "cmd": "<show><jobs><id>999999</id></jobs></show>"
  },
  "panos_version": "11.1",
  "description": "Error for a job id that does not exist",
  "provenance": {
    "source": "synthetic",
    "url": "https://docs.paloaltonetworks.com/pan-os/11-1/pan-os-panorama-api/get-started-with-the-pan-os-xml-api/explore-the-api",
    "notes": "Hand-authored response following the request/response structure described in the PAN-OS and Panorama XML API guide (provenance.url); not a verbatim copy. Unverified against a live Panorama. Exact error wording for an unknown job id is unverified."
  },
  "sanitization": {
    "tool_version": "panos-mcp 0.1.0",
    "sanitized_at": "2026-10-17T07:51:48Z",
    "leak_check": "passed"
  },
  "status": "unverified"
}
