{
  "id": "11.2/op/request-license-info/baseline",
  "request": {
    "type": "op",
    "cmd": "<request><license><info></info></license></request>"
  },
  "panos_version": "11.2",
  "description": "Panorama licenses, one expired",
  "provenance": {
    "source": "synthetic",
    "url": "https://docs.paloaltonetworks.com/pan-os/11-1/pan-os-panorama-api/get-started-with-the-pan-os-xml-api/explore-the-api",
    "notes": "Hand-authored response following the request/response structure described in the PAN-OS and Panorama XML API guide (provenance.url); not a verbatim copy. Unverified against a live Panorama. Identical in structure to the 11.1 sample per documentation (11.1 & later guide)."
  },
  "sanitization": {
    "tool_version": "panos-mcp 0.1.0",
    "sanitized_at": "2026-10-17T07:51:48Z",
    "leak_check": "passed"
  },
  "status": "unverified"
}
