{
  "id": "11.1/op/show-high-availability-state/passive",
  "request": {
    "type": "op",
    "cmd": "<show><high-availability><state></state></high-availability></show>"
  },
  "panos_version": "11.1",
  "description": "Panorama HA state: passive",
  "provenance": {
    "source": "synthetic",
    "url": "https://docs.paloaltonetworks.com/pan-os/11-1/pan-os-panorama-api/get-started-with-the-pan-os-xml-api/explore-the-api",
    "notes": "Hand-authored response following the request/response structure described in the PAN-OS and Panorama XML API guide (provenance.url); not a verbatim copy. Unverified against a live Panorama."
  },
  "sanitization": {
    "tool_version": "panos-mcp 0.1.0",
    "sanitized_at": "2026-10-17T07:51:48Z",
    "leak_check": "passed"
  },
  "status": "unverified"
}
