{
  "id": "11.1/op/show-devices-all/one-disconnected",
  "request": {
    "type": "op",
    "cmd": "<show><devices><all></all></devices></show>"
  },
  "panos_version": "11.1",
  "description": "Baseline estate with fw-branch-01 disconnected",
  "provenance": {
    "source": "synthetic",
    "url": "https://docs.paloaltonetworks.com/pan-os/11-1/pan-os-panorama-api/pan-os-xml-api-use-cases/query-a-firewall-from-panorama-api",
    "notes": "Hand-authored response following the request/response structure described in the PAN-OS and Panorama XML API guide (provenance.url); not a verbatim copy. Unverified against a live Panorama."
  },
  "sanitization": {
    "tool_version": "panos-mcp 0.1.0",
    "sanitized_at": "2026-10-17T07:51:48Z",
    "leak_check": "passed"
  },
  "status": "unverified"
}
